<?xml version="1.0"?>
<!DOCTYPE body SYSTEM "../../tools/xmltree/gigawidgets.dtd">
<body color="#254" rotation="90">
    <column size="100vh 100vw">
        <row size="100vh 75vw">
            <!-- Album Art -->
            <panel size="50vh 75vw" color="#4a8">
                <image align="center center" source="image" />
            </panel>
            <!-- Song/Artist/Album details -->
            <column size="50vh 30vw" align="right center" padding="0.2cm 0">
                <text font="FreeSerifBold24pt7b">Song Name</text>
                <text font="FreeSerif18pt7b">Album Name</text>
                <text font="FreeSerif18pt7b">Artist Name</text>
                <text font="FreeSerif18pt7b">1/20</text>
                <text id="status" font="FreeSerif18pt7b" color="gray">Paused</text>
            </column>
        </row>

        <!-- Controls -->
        <panel size="100vh 25vw" color="#386">
            <row size="69vh 25vw" padding="5px" align="center center">
                <image source="backward_fast" onpress="mark" onrelease="unmark" />
                <image source="backward" onpress="mark" onrelease="unmark" />
                <image source="play" onpress="mark" onrelease="toggle_player" />
                <image source="forward" onpress="mark" onrelease="unmark" />
                <image source="forward_fast" onpress="mark" onrelease="unmark" />
            </row>
        </panel>
    </column>
</body>
 
